{
  "slug": "programmierung",
  "title": "Programmierung",
  "description": "Du bist Entwickler bei einem kleinen Startup – und musst heute das Backend retten.",
  "iconEmoji": "🐍",
  "sortOrder": 1,
  "tasks": [
    {
      "slug": "p1",
      "title": "Was ist eine Variable?",
      "difficulty": "EASY",
      "points": 10,
      "type": "MULTIPLE_CHOICE",
      "sortOrder": 1,
      "story": "<p>Dein erster Tag als Junior-Entwickler! Dein Chef fragt dich: \\\"Erkläre mir in einem Satz was eine Variable in Python ist.\"</p>",
      "description": "<p>Wähle die richtige Erklärung.</p>",
      "config": {
        "options": [
          "Eine Variable ist eine feste Zahl die man nicht ändern kann",
          "Eine Variable ist ein benannter Speicherplatz für einen Wert",
          "Eine Variable ist ein Befehl der etwas ausgibt",
          "Eine Variable ist nur in Mathe nützlich"
        ],
        "correct": [
          1
        ],
        "hint": "Stell dir eine Variable wie eine beschriftete Schublade vor – du kannst hineinlegen was du möchtest."
      }
    },
    {
      "slug": "p2",
      "title": "Dein erster Bug",
      "difficulty": "EASY",
      "points": 10,
      "type": "MULTIPLE_CHOICE",
      "sortOrder": 2,
      "story": "<p>Dein Roboter soll \\\"Hallo Welt\" sagen – aber er schweigt. Schau dir seinen Code an:</p><pre><code>nachricht = \"Hallo Welt\"\nPrint(nachricht)</code></pre><p>Kannst du den Fehler finden?</p>",
      "description": "<p>Was ist falsch an diesem Code?</p>",
      "config": {
        "options": [
          "nachricht ist kein gültiger Variablenname",
          "print muss großgeschrieben sein: Print",
          "Der Text braucht keine Anführungszeichen",
          "Python achtet auf Groß- und Kleinschreibung – print muss kleingeschrieben sein"
        ],
        "correct": [
          3
        ],
        "hint": "Python unterscheidet zwischen Groß- und Kleinschreibung. print() ist ein eingebauter Befehl."
      }
    },
    {
      "slug": "p3",
      "title": "Variablen-Detektiv",
      "difficulty": "EASY",
      "points": 10,
      "type": "MULTIPLE_CHOICE",
      "sortOrder": 3,
      "story": "<p>Ein Kollege hat diesen Code geschrieben. Ohne ihn auszuführen: Was gibt <code>print(ergebnis)</code> am Ende aus?</p><pre><code>zahl = 10\nzahl = zahl + 5\nzahl = zahl * 2\nergebnis = zahl - 3\nprint(ergebnis)</code></pre>",
      "description": "<p>Berechne das Ergebnis im Kopf – gehe Zeile für Zeile durch.</p>",
      "config": {
        "options": [
          "20",
          "25",
          "27",
          "30"
        ],
        "correct": [
          2
        ],
        "hint": "Zeile 1: zahl = 10 → Zeile 2: zahl = 10+5 = 15 → Zeile 3: zahl = 15×2 = 30 → Zeile 4: ergebnis = 30-3 = ?"
      }
    },
    {
      "slug": "p4",
      "title": "Lücke im Passwort-Generator",
      "difficulty": "EASY",
      "points": 15,
      "type": "FILL_CODE",
      "sortOrder": 4,
      "story": "<p>Du baust einen Passwort-Generator der 5 Sternchen als Platzhalter anzeigt. Die Schleife ist fast fertig – zwei Wörter fehlen noch:</p>",
      "description": "<p>Ergänze die fehlenden Schlüsselwörter der for-Schleife.</p>",
      "config": {
        "template": "___ i ___ range(5):\n    print('*')",
        "blanks": [
          {
            "index": 0,
            "answer": "for",
            "caseSensitive": true
          },
          {
            "index": 1,
            "answer": "in",
            "caseSensitive": true
          }
        ],
        "expectedOutput": "*\n*\n*\n*\n*\n",
        "hint": "Eine for-Schleife beginnt immer mit dem Schlüsselwort for, dann der Variable, dann in, dann die Menge."
      }
    },
    {
      "slug": "p5",
      "title": "Der Türsteher",
      "difficulty": "MEDIUM",
      "points": 10,
      "type": "MULTIPLE_CHOICE",
      "sortOrder": 5,
      "story": "<p>Du programmierst das Einlass-System für eine Veranstaltung:</p><pre><code>alter = 15\n\nif alter >= 18:\n    print(\"Willkommen!\")\nelse:\n    print(\"Zutritt verweigert.\")</code></pre>",
      "description": "<p>Welche Ausgabe erzeugt dieser Code wenn <code>alter = 15</code> ist?</p>",
      "config": {
        "options": [
          "Willkommen!",
          "Zutritt verweigert.",
          "Nichts – der Code hat einen Fehler",
          "Beide Texte werden ausgegeben"
        ],
        "correct": [
          1
        ],
        "hint": "Python prüft die Bedingung nach if zuerst. 15 >= 18 ist falsch, also geht er in den else-Zweig."
      }
    },
    {
      "slug": "p6",
      "title": "Bug-Hunt: Die kaputte Funktion",
      "difficulty": "MEDIUM",
      "points": 10,
      "type": "MULTIPLE_CHOICE",
      "sortOrder": 6,
      "story": "<p>Deine Funktion für den Flächeninhalt gibt falsche Werte zurück:</p><pre><code>def flaeche(breite, hoehe):\n    return breite + hoehe\n\nprint(flaeche(4, 5))  # Gibt 9 aus – erwartet: 20</code></pre>",
      "description": "<p>Die Funktion berechnet den Flächeninhalt falsch. Was ist der Fehler?</p>",
      "config": {
        "options": [
          "Die Funktion hat den falschen Namen",
          "Es fehlt das Schlüsselwort return",
          "Es muss * statt + stehen – Fläche = Breite × Höhe",
          "Die Parameter sind falsch benannt"
        ],
        "correct": [
          2
        ],
        "hint": "Die Formel für den Flächeninhalt eines Rechtecks lautet: Breite × Höhe. Welcher Operator fehlt?"
      }
    },
    {
      "slug": "p7",
      "title": "Countdown-Rakete",
      "difficulty": "MEDIUM",
      "points": 15,
      "type": "FILL_CODE",
      "sortOrder": 7,
      "story": "<p>Der Countdown zur Raketenzündung soll rückwärts von 10 bis 1 laufen. Ergänze den fehlenden Code:</p>",
      "description": "<p>Ergänze die drei Lücken im range()-Aufruf damit der Countdown rückwärts läuft.</p>",
      "config": {
        "template": "___ i in range(10, ___, ___):\n    print(i)\nprint('🚀 Start!')",
        "blanks": [
          {
            "index": 0,
            "answer": "for",
            "caseSensitive": true
          },
          {
            "index": 1,
            "answer": "0",
            "caseSensitive": true
          },
          {
            "index": 2,
            "answer": "-1",
            "caseSensitive": true
          }
        ],
        "expectedOutput": "10\n9\n8\n7\n6\n5\n4\n3\n2\n1\n🚀 Start!\n",
        "hint": "range(start, stop, step): start ist 10, stop ist 0 (nicht mitgezählt), step ist -1 damit es rückwärts geht."
      }
    },
    {
      "slug": "p8",
      "title": "Listen verstehen",
      "difficulty": "MEDIUM",
      "points": 10,
      "type": "MULTIPLE_CHOICE",
      "sortOrder": 8,
      "story": "<p>Dein Team speichert die Highscores der Woche in einer Liste:</p><pre><code>scores = [42, 87, 15, 99, 33]\nprint(scores[2])</code></pre><p>Zähle die Indizes von links – bei welchem Wert landen wir?</p>",
      "description": "<p>Was gibt <code>print(scores[2])</code> aus?</p>",
      "config": {
        "options": [
          "42",
          "87",
          "15",
          "99"
        ],
        "correct": [
          2
        ],
        "hint": "Wichtig: Listen in Python starten bei Index 0, nicht bei 1. scores[0]=42, scores[1]=87, scores[2]=?"
      }
    },
    {
      "slug": "p9",
      "title": "Die kaputte Liste",
      "difficulty": "MEDIUM",
      "points": 10,
      "type": "MULTIPLE_CHOICE",
      "sortOrder": 9,
      "story": "<p>Dein Kollege will das Element an Position 3 löschen – aber er bekommt einen Fehler:</p><pre><code>früchte = [\"Apfel\", \"Banane\", \"Mango\"]\nfrüchte.remove(3)\nprint(früchte)</code></pre>",
      "description": "<p>Dein Kollege bekommt einen Fehler. Was ist die Ursache?</p>",
      "config": {
        "options": [
          "remove() existiert in Python nicht",
          "remove() löscht nach Wert, nicht nach Index – der Wert 3 ist nicht in der Liste",
          "Listen können keine Strings speichern",
          "Es fehlt ein Semikolon am Ende"
        ],
        "correct": [
          1
        ],
        "hint": "Es gibt zwei Methoden: remove(wert) sucht den Wert und löscht ihn. del liste[index] löscht an einer Position."
      }
    },
    {
      "slug": "p10",
      "title": "FizzBuzz-Klassiker",
      "difficulty": "HARD",
      "points": 20,
      "type": "CODE",
      "sortOrder": 10,
      "story": "<p>FizzBuzz ist der bekannteste Einstellungstest in der Programmierung. Zahlen 1–15: Vielfache von 3 → \\\"Fizz\", Vielfache von 5 → \\\"Buzz\", beides → \\\"FizzBuzz\", sonst die Zahl selbst.</p>",
      "description": "<p>Implementiere die FizzBuzz-Logik vollständig.</p>",
      "config": {
        "starterCode": "for i in range(1, 16):\n    # Prüfe zuerst: Ist i durch 3 UND durch 5 teilbar? (Modulo-Operator: %)\n    # Dann: Nur durch 3? Nur durch 5? Sonst: Zahl ausgeben\n    pass",
        "expectedOutput": "1\n2\nFizz\n4\nBuzz\nFizz\n7\n8\nFizz\nBuzz\n11\nFizz\n13\n14\nFizzBuzz\n",
        "hint": "Der Modulo-Operator % gibt den Rest einer Division zurück. 15 % 3 == 0 heißt: 15 ist durch 3 teilbar. Prüfe zuerst auf FizzBuzz (beide Bedingungen), sonst greift nur eine!"
      }
    },
    {
      "slug": "p11",
      "title": "Wörterbuch durchsuchen",
      "difficulty": "HARD",
      "points": 15,
      "type": "FILL_CODE",
      "sortOrder": 11,
      "story": "<p>Du baust ein Mini-Telefonbuch für die Schule. Alle Kontakte sollen ausgegeben werden:</p>",
      "description": "<p>Ergänze die drei Lücken damit alle Kontakte ausgegeben werden.</p>",
      "config": {
        "template": "kontakte = {\n    'Anna': '0151-111',\n    'Ben': '0162-222',\n    'Clara': '0173-333'\n}\n\n___ name, nummer ___ kontakte.___():\n    print(f'{name}: {nummer}')",
        "blanks": [
          {
            "index": 0,
            "answer": "for",
            "caseSensitive": true
          },
          {
            "index": 1,
            "answer": "in",